[
  {
    "id": "agicto",
    "name": "AGICTO",
    "aliases": [],
    "operator": "AGICTO",
    "type": "third-party-proxy",
    "website": "https://api.agicto.cn",
    "api_base_urls": [
      "https://api.agicto.cn"
    ],
    "api_compat": [
      "openai"
    ],
    "models": [],
    "pricing": {
      "unit": "",
      "ratio_note": ""
    },
    "payment_methods": [],
    "backend": {
      "software": "",
      "version": "",
      "detected_by": ""
    },
    "region": "CN",
    "status": "active",
    "first_seen": "2026-10-20",
    "last_checked": "2026-10-20",
    "discovery_source": {
      "channel": "known",
      "url": "https://api.agicto.cn"
    },
    "related_ids": [],
    "related_sites": [],
    "icon": "",
    "risk_notes": "目录收录不等于推荐或背书。第三方代理与社区中转可能与上游服务条款或当地法规冲突。",
    "evidence": [
      {
        "url": "https://api.agicto.cn",
        "title": "AGICTO",
        "checked_at": "2026-10-20",
        "http": 200,
        "api_status": "404"
      }
    ]
  },
  {
    "id": "ai302",
    "name": "302.AI",
    "aliases": [
      "AI302"
    ],
    "operator": "302.AI",
    "type": "third-party-proxy",
    "website": "https://302.ai",
    "api_base_urls": [
      "https://api.302.ai",
      "https://api.302ai.cn"
    ],
    "api_compat": [
      "openai"
    ],
    "models": [],
    "pricing": {
      "unit": "token",
      "ratio_note": "按用量付费（来自主页文案，未核价）"
    },
    "payment_methods": [
      "pay-as-you-go"
    ],
    "backend": {
      "software": "",
      "version": "",
      "detected_by": ""
    },
    "region": "unverified",
    "status": "active",
    "first_seen": "2026-10-20",
    "last_checked": "2026-10-20",
    "discovery_source": {
      "channel": "known",
      "url": "https://302.ai"
    },
    "related_ids": [
      "ai302-api",
      "ai302-cn"
    ],
    "related_sites": [
      "https://api.302.ai",
      "https://api.302ai.cn"
    ],
    "icon": "",
    "risk_notes": "目录收录不等于推荐或背书。第三方代理与社区中转可能与上游服务条款或当地法规冲突。",
    "evidence": [
      {
        "url": "https://302.ai",
        "title": "企业级AI资源平台 - 302.AI | 按用量付费，全模型API接入，应用在线使用",
        "checked_at": "2026-10-20",
        "http": 200,
        "api_status": "200"
      },
      {
        "url": "https://api.302.ai",
        "title": "企业级AI资源平台 - 302.AI | 按用量付费，全模型API接入，应用在线使用",
        "checked_at": "2026-10-20",
        "http": 200,
        "api_status": "200"
      }
    ]
  },
  {
    "id": "ai302-api",
    "name": "AI302 API",
    "aliases": [],
    "operator": "302.AI",
    "type": "third-party-proxy",
    "website": "https://api.302.ai",
    "api_base_urls": [
      "https://api.302.ai"
    ],
    "api_compat": [
      "openai"
    ],
    "models": [],
    "pricing": {
      "unit": "",
      "ratio_note": ""
    },
    "payment_methods": [],
    "backend": {
      "software": "",
      "version": "",
      "detected_by": ""
    },
    "region": "unverified",
    "status": "active",
    "first_seen": "2026-10-20",
    "last_checked": "2026-10-20",
    "discovery_source": {
      "channel": "known",
      "url": "https://api.302.ai"
    },
    "related_ids": [
      "ai302",
      "ai302-cn"
    ],
    "related_sites": [
      "https://302.ai",
      "https://api.302ai.cn"
    ],
    "icon": "",
    "risk_notes": "目录收录不等于推荐或背书。第三方代理与社区中转可能与上游服务条款或当地法规冲突。",
    "evidence": [
      {
        "url": "https://api.302.ai",
        "title": "AI302 Api",
        "checked_at": "2026-10-20",
        "http": 200,
        "api_status": "401"
      }
    ]
  },
  {
    "id": "ai302-cn",
    "name": "AI302 API (cn)",
    "aliases": [],
    "operator": "302.AI",
    "type": "third-party-proxy",
    "website": "https://api.302ai.cn",
    "api_base_urls": [
      "https://api.302ai.cn"
    ],
    "api_compat": [
      "openai"
    ],
    "models": [],
    "pricing": {
      "unit": "",
      "ratio_note": ""
    },
    "payment_methods": [],
    "backend": {
      "software": "",
      "version": "",
      "detected_by": ""
    },
    "region": "CN",
    "status": "active",
    "first_seen": "2026-10-20",
    "last_checked": "2026-10-20",
    "discovery_source": {
      "channel": "known",
      "url": "https://api.302ai.cn"
    },
    "related_ids": [
      "ai302",
      "ai302-api"
    ],
    "related_sites": [
      "https://302.ai",
      "https://api.302.ai"
    ],
    "icon": "",
    "risk_notes": "目录收录不等于推荐或背书。第三方代理与社区中转可能与上游服务条款或当地法规冲突。",
    "evidence": [
      {
        "url": "https://api.302ai.cn",
        "title": "AI302 Api",
        "checked_at": "2026-10-20",
        "http": 200,
        "api_status": "401"
      }
    ]
  },
  {
    "id": "aicore-api",
    "name": "AiCore API",
    "aliases": [
      "One API",
      "xty"
    ],
    "operator": "AiCore API",
    "type": "community-relay",
    "website": "https://api.xty.app",
    "api_base_urls": [
      "https://api.xty.app"
    ],
    "api_compat": [
      "openai"
    ],
    "models": [],
    "pricing": {
      "unit": "",
      "ratio_note": ""
    },
    "payment_methods": [],
    "backend": {
      "software": "new-api/one-api",
      "version": "",
      "detected_by": "GET /api/status"
    },
    "region": "unverified",
    "status": "active",
    "first_seen": "2026-10-20",
    "last_checked": "2026-10-20",
    "discovery_source": {
      "channel": "known",
      "url": "https://api.xty.app"
    },
    "related_ids": [],
    "related_sites": [],
    "icon": "",
    "risk_notes": "目录收录不等于推荐或背书。第三方代理与社区中转可能与上游服务条款或当地法规冲突。",
    "evidence": [
      {
        "url": "https://api.xty.app",
        "title": "One API",
        "checked_at": "2026-10-20",
        "http": 200,
        "api_status": "AiCore API"
      }
    ]
  },
  {
    "id": "aigc369",
    "name": "AIGC369",
    "aliases": [],
    "operator": "AIGC369",
    "type": "community-relay",
    "website": "https://api.aigc369.com",
    "api_base_urls": [
      "https://api.aigc369.com"
    ],
    "api_compat": [],
    "models": [],
    "pricing": {
      "unit": "",
      "ratio_note": ""
    },
    "payment_methods": [],
    "backend": {
      "software": "",
      "version": "",
      "detected_by": ""
    },
    "region": "unverified",
    "status": "dead",
    "first_seen": "2026-10-20",
    "last_checked": "2026-10-20",
    "discovery_source": {
      "channel": "known",
      "url": "https://api.aigc369.com"
    },
    "related_ids": [],
    "related_sites": [],
    "icon": "",
    "risk_notes": "最近一次探测主机不可达。目录收录不等于背书。",
    "evidence": [
      {
        "url": "https://api.aigc369.com",
        "title": "AIGC369",
        "checked_at": "2026-10-20",
        "http": 0,
        "api_status": "555"
      }
    ]
  },
  {
    "id": "aigcbest",
    "name": "钱多多 API",
    "aliases": [
      "aigcbest"
    ],
    "operator": "钱多多 API",
    "type": "community-relay",
    "website": "https://api.aigcbest.top",
    "api_base_urls": [
      "https://api.aigcbest.top"
    ],
    "api_compat": [
      "openai"
    ],
    "models": [],
    "pricing": {
      "unit": "",
      "ratio_note": ""
    },
    "payment_methods": [],
    "backend": {
      "software": "new-api/one-api",
      "version": "0.7.0-rc.11",
      "detected_by": "GET /api/status"
    },
    "region": "unverified",
    "status": "active",
    "first_seen": "2026-10-20",
    "last_checked": "2026-10-20",
    "discovery_source": {
      "channel": "known",
      "url": "https://api.aigcbest.top"
    },
    "related_ids": [],
    "related_sites": [
      "https://api2.aigcbest.top"
    ],
    "icon": "",
    "risk_notes": "目录收录不等于推荐或背书。第三方代理与社区中转可能与上游服务条款或当地法规冲突。",
    "evidence": [
      {
        "url": "https://api.aigcbest.top",
        "title": "钱多多 API - OpenAI 兼容的大模型中转",
        "checked_at": "2026-10-20",
        "http": 200,
        "api_status": "钱多多 API 0.7.0-rc.11"
      }
    ]
  },
  {
    "id": "aihubmix",
    "name": "AIHubMix",
    "aliases": [],
    "operator": "AIHubMix",
    "type": "third-party-proxy",
    "website": "https://aihubmix.com",
    "api_base_urls": [
      "https://aihubmix.com"
    ],
    "api_compat": [
      "openai"
    ],
    "models": [],
    "pricing": {
      "unit": "",
      "ratio_note": ""
    },
    "payment_methods": [],
    "backend": {
      "software": "new-api/one-api",
      "version": "",
      "detected_by": "GET /api/status"
    },
    "region": "unverified",
    "status": "active",
    "first_seen": "2026-10-20",
    "last_checked": "2026-10-20",
    "discovery_source": {
      "channel": "known",
      "url": "https://aihubmix.com"
    },
    "related_ids": [],
    "related_sites": [],
    "icon": "",
    "risk_notes": "目录收录不等于推荐或背书。第三方代理与社区中转可能与上游服务条款或当地法规冲突。",
    "evidence": [
      {
        "url": "https://aihubmix.com",
        "title": "AIHubMix - One API for Any Model",
        "checked_at": "2026-10-20",
        "http": 200,
        "api_status": "AIHubMix"
      }
    ]
  },
  {
    "id": "aiproxy",
    "name": "AIProxy",
    "aliases": [],
    "operator": "AIProxy",
    "type": "third-party-proxy",
    "website": "https://aiproxy.io",
    "api_base_urls": [
      "https://aiproxy.io"
    ],
    "api_compat": [],
    "models": [],
    "pricing": {
      "unit": "",
      "ratio_note": ""
    },
    "payment_methods": [],
    "backend": {
      "software": "",
      "version": "",
      "detected_by": ""
    },
    "region": "unverified",
    "status": "dead",
    "first_seen": "2026-10-20",
    "last_checked": "2026-10-20",
    "discovery_source": {
      "channel": "known",
      "url": "https://aiproxy.io"
    },
    "related_ids": [],
    "related_sites": [],
    "icon": "",
    "risk_notes": "最近一次探测主机不可达。目录收录不等于背书。",
    "evidence": [
      {
        "url": "https://aiproxy.io",
        "title": "AIProxy",
        "checked_at": "2026-10-20",
        "http": 0,
        "api_status": "UND_ERR_CONNECT_TIMEOUT"
      }
    ]
  },
  {
    "id": "api2d",
    "name": "API2D",
    "aliases": [],
    "operator": "API2D",
    "type": "third-party-proxy",